{
  "cis_controls_version": "7",
  "generated_at": "2026-02-12",
  "source": "CIS Controls v7.1 + cyber.trackr.live/api CCI lookup",
  "entry_count": 172,
  "mappings": [
    {
      "cis_id": "0.0",
      "cis_title": "Explicitly Not Mapped",
      "primary_cci": null,
      "supporting_ccis": [],
      "nist_control": "N/A",
      "coverage_assessment": "CIS explicitly does not map this control to any CIS Controls safeguard.",
      "mapping_status": "NOT_MAPPED"
    },
    {
      "cis_id": "1.1",
      "cis_title": "Utilize an Active Discovery Tool",
      "primary_cci": {
        "cci": "CCI-002641",
        "confidence": 0.95,
        "reasoning": "SI-4.2 \u2014 monitors the system to detect attacks and indicators of potential attacks. Active discovery tools are a form of system monitoring that detects unauthorized assets/connections."
      },
      "supporting_ccis": [],
      "nist_control": "SI-4",
      "coverage_assessment": "SI-4 broadly covers system monitoring including active network discovery. Direct match for active scanning/discovery tools.",
      "mapping_status": "OFFICIAL"
    },
    {
      "cis_id": "1.2",
      "cis_title": "Use a Passive Asset Discovery Tool",
      "primary_cci": {
        "cci": "CCI-002641",
        "confidence": 0.9,
        "reasoning": "SI-4.2 \u2014 system monitoring to detect attacks and indicators. Passive discovery is a monitoring technique that observes network traffic rather than actively probing."
      },
      "supporting_ccis": [
        {
          "cci": "CCI-000389",
          "reasoning": "CM-8.1 \u2014 develop/document inventory that accurately reflects the system. Passive discovery feeds asset inventory.",
          "confidence": 0.85
        }
      ],
      "nist_control": "SI-4",
      "coverage_assessment": "SI-4 covers passive monitoring techniques. CM-8 adds inventory context since passive discovery is used to maintain asset awareness.",
      "mapping_status": "OFFICIAL"
    },
    {
      "cis_id": "1.3",
      "cis_title": "Use DHCP Logging to Update Asset Inventory",
      "primary_cci": {
        "cci": "CCI-000389",
        "confidence": 0.9,
        "reasoning": "CM-8.1 \u2014 develop/document inventory that accurately reflects the current system. DHCP logging is a mechanism to keep hardware asset inventory accurate and current."
      },
      "supporting_ccis": [],
      "nist_control": "CM-8",
      "coverage_assessment": "CM-8 covers maintaining accurate system component inventory. DHCP logging is a technique to ensure inventory reflects actual network-connected devices.",
      "mapping_status": "OFFICIAL"
    },
    {
      "cis_id": "1.4",
      "cis_title": "Maintain Detailed Asset Inventory",
      "primary_cci": {
        "cci": "CCI-000389",
        "confidence": 0.95,
        "reasoning": "CM-8.1 requires developing an inventory of information system components that accurately reflects the current system."
      },
      "supporting_ccis": [
        {
          "cci": "CCI-000395",
          "confidence": 0.9,
          "reasoning": "CM-8.3 requires inventory at the level of granularity deemed necessary for tracking and reporting."
        },
        {
          "cci": "CCI-001780",
          "confidence": 0.85,
          "reasoning": "CM-8.7 requires reviewing and updating the inventory per organization-defined frequency."
        }
      ],
      "nist_control": "CM-8",
      "coverage_assessment": "Strong coverage. CM-8 is the definitive NIST control for system component inventory.",
      "mapping_status": "OFFICIAL"
    },
    {
      "cis_id": "1.5",
      "cis_title": "Maintain Asset Inventory Information",
      "primary_cci": {
        "cci": "CCI-000389",
        "confidence": 0.95,
        "reasoning": "CM-8.1 \u2014 develop/document inventory that accurately reflects the current system. Direct match: maintaining asset inventory information is the core requirement of CM-8."
      },
      "supporting_ccis": [
        {
          "cci": "CCI-001780",
          "reasoning": "CM-8.7 \u2014 reviews and updates the component inventory per defined frequency. Covers the ongoing maintenance aspect.",
          "confidence": 0.85
        }
      ],
      "nist_control": "CM-8",
      "coverage_assessment": "CM-8 is the canonical NIST control for asset inventory management. Near-perfect alignment.",
      "mapping_status": "OFFICIAL"
    },
    {
      "cis_id": "1.6",
      "cis_title": "Address Unauthorized Assets",
      "primary_cci": {
        "cci": "CCI-000389",
        "confidence": 0.85,
        "reasoning": "CM-8.1 \u2014 inventory that accurately reflects the system. Addressing unauthorized assets requires knowing what is authorized vs. not, which is the inventory's purpose."
      },
      "supporting_ccis": [
        {
          "cci": "CCI-002641",
          "reasoning": "SI-4.2 \u2014 monitoring to detect attacks and unauthorized connections. Detecting unauthorized assets is a monitoring function.",
          "confidence": 0.85
        }
      ],
      "nist_control": "CM-8",
      "coverage_assessment": "CM-8 combined with CM-8(3) (automated unauthorized component detection) covers this best. Primary CCI from CM-8 base control since CM-8(3) CCIs tie to inventory accuracy.",
      "mapping_status": "OFFICIAL"
    },
    {
      "cis_id": "1.7",
      "cis_title": "Deploy Port Level Access Control",
      "primary_cci": {
        "cci": "CCI-001097",
        "confidence": 0.9,
        "reasoning": "SC-7.1 \u2014 monitors and controls communications at the external boundary and key internal boundaries. Port-level access control (802.1X, NAC) is boundary protection at the network port level."
      },
      "supporting_ccis": [],
      "nist_control": "SC-7",
      "coverage_assessment": "SC-7 covers boundary protection including port-level access controls. 802.1X and NAC are implementations of boundary protection at the physical/data-link layer.",
      "mapping_status": "OFFICIAL"
    },
    {
      "cis_id": "1.8",
      "cis_title": "Utilize Client Certificates to Authenticate Hardware Assets",
      "primary_cci": {
        "cci": "CCI-000778",
        "confidence": 0.95,
        "reasoning": "IA-3.2 \u2014 uniquely identifies organization-defined devices before establishing connections. Client certificates are a device identification and authentication mechanism."
      },
      "supporting_ccis": [
        {
          "cci": "CCI-001958",
          "reasoning": "IA-3.3 \u2014 authenticates organization-defined devices before establishing connections. The authentication complement to identification.",
          "confidence": 0.85
        }
      ],
      "nist_control": "IA-3",
      "coverage_assessment": "IA-3 is the exact NIST control for device identification and authentication. Client certificates are a primary mechanism for implementing IA-3.",
      "mapping_status": "OFFICIAL"
    },
    {
      "cis_id": "2.1",
      "cis_title": "Maintain Inventory of Authorized Software",
      "primary_cci": {
        "cci": "CCI-000389",
        "confidence": 0.9,
        "reasoning": "CM-8.1 \u2014 develop/document inventory that accurately reflects the current system. CM-8 covers both hardware and software component inventory."
      },
      "supporting_ccis": [],
      "nist_control": "CM-8",
      "coverage_assessment": "CM-8 covers system component inventory including software. The control statements explicitly reference software components in the discussion.",
      "mapping_status": "OFFICIAL"
    },
    {
      "cis_id": "2.2",
      "cis_title": "Ensure Software is Supported by Vendor",
      "primary_cci": {
        "cci": "CCI-003376",
        "confidence": 0.95,
        "reasoning": "SA-22.1 \u2014 component replacement verification. SA-22 directly addresses replacing system components when vendor support is no longer available."
      },
      "supporting_ccis": [],
      "nist_control": "SA-22",
      "coverage_assessment": "SA-22 (Unsupported System Components) is the exact NIST control for ensuring software/firmware has active vendor support. Direct alignment.",
      "mapping_status": "OFFICIAL"
    },
    {
      "cis_id": "2.3",
      "cis_title": "Utilize Software Inventory Tools",
      "primary_cci": {
        "cci": "CCI-000389",
        "confidence": 0.9,
        "reasoning": "CM-8.1 \u2014 develop/document inventory that accurately reflects the system. Software inventory tools are the mechanism to implement the CM-8 inventory requirement."
      },
      "supporting_ccis": [],
      "nist_control": "CM-8",
      "coverage_assessment": "CM-8 covers system component inventory. The use of automated tools is addressed in CM-8(2) (automated maintenance) but the base control CCI captures the requirement.",
      "mapping_status": "OFFICIAL"
    },
    {
      "cis_id": "2.4",
      "cis_title": "Track Software Inventory Information",
      "primary_cci": {
        "cci": "CCI-000399",
        "confidence": 0.9,
        "reasoning": "CM-8.5 \u2014 inventory that includes organization-defined information for effective component accountability. Tracking specific software inventory attributes (name, version, vendor, etc.) maps to accountability information."
      },
      "supporting_ccis": [],
      "nist_control": "CM-8",
      "coverage_assessment": "CM-8 assessment procedure 5 specifically covers including organization-defined accountability information in the inventory, which is what tracking software attributes achieves.",
      "mapping_status": "OFFICIAL"
    },
    {
      "cis_id": "2.5",
      "cis_title": "Integrate Software and Hardware Asset Inventories",
      "primary_cci": {
        "cci": "CCI-000392",
        "confidence": 0.85,
        "reasoning": "CM-8.2 \u2014 inventory includes all components within the authorization boundary. An integrated inventory that covers both hardware and software ensures completeness within the boundary."
      },